{
  "$schema": "http://json-schema.org/draft-07/schema#",
  "$id": "https://hyozuboard.dev/schemas/card/v6",
  "title": "hyozuboard Card",
  "description": "A card is a self-contained data packet pinned to the home screen. All values for all selectable dimension combinations are pre-loaded — toggling is instant, local, zero-fetch. Selectors and context are always visible regardless of card size. The show array controls progressive disclosure of body elements only.",

  "type": "object",
  "required": ["id", "type", "header", "body", "footer", "sizing"],
  "additionalProperties": false,

  "properties": {
    "id": { "type": "string" },
    "type": { "enum": ["metric", "table"] },

    "header": {
      "type": "object",
      "required": ["label"],
      "properties": {
        "label": { "type": "string", "description": "Displayed uppercase in the card header row." }
      }
    },

    "meta": {
      "type": "object",
      "description": "Contextual metadata for AI reasoning, search, and interpretation. Not rendered visually — consumed by agents and the platform.",
      "properties": {
        "description": { "type": "string", "description": "Plain-language explanation of what this card measures, why it matters, and how to interpret it." },
        "currency": { "type": "string", "pattern": "^[A-Z]{3}$", "description": "ISO 4217 currency code. Omit for non-monetary values." },
        "unit": { "enum": ["currency", "ratio", "percent", "bps", "months", "days", "count", "score"], "description": "What kind of value this is." },
        "magnitude": { "enum": ["units", "thousands", "millions", "billions"], "description": "What the display value is expressed in. Lets AI do math correctly." },
        "tags": { "type": "array", "items": { "type": "string" }, "description": "For search and AI routing." },
        "thresholds": {
          "type": "array",
          "description": "Named reference points for AI interpretation. Not rendered.",
          "items": {
            "type": "object",
            "required": ["label", "value"],
            "properties": {
              "label": { "type": "string" },
              "value": { "type": "number", "description": "Same unit and magnitude as the card value." },
              "direction": { "enum": ["above_is_good", "below_is_good", "neutral"] }
            }
          }
        }
      }
    },

    "selectors": {
      "type": "object",
      "description": "Toggleable axes. Rendered as dropdown selects inline in the card header row. Always visible. Toggling filters the pre-loaded data array locally — no fetch required.",
      "additionalProperties": {
        "type": "object",
        "required": ["options", "default"],
        "properties": {
          "options": { "type": "array", "items": { "type": "string" }, "minItems": 2 },
          "default": { "type": "string" }
        }
      }
    },

    "context": {
      "type": "object",
      "description": "Fixed dimensional labels. Always visible. Rendered as subtle pills in the card footer zone. Not interactive.",
      "additionalProperties": { "type": "string" }
    },

    "body": {
      "oneOf": [
        { "$ref": "#/$defs/metric_body" },
        { "$ref": "#/$defs/table_body" }
      ]
    },

    "footer": {
      "type": "object",
      "required": ["author", "updated"],
      "properties": {
        "author": {
          "type": "object",
          "required": ["user_id"],
          "properties": {
            "user_id": { "type": "string" },
            "display_name": { "type": "string", "description": "Cached display name. Fallback when host can't resolve user_id." },
            "email": { "type": "string", "format": "email" }
          }
        },
        "data_source": {
          "type": "object",
          "description": "Rendered as a small circular icon with tooltip in the footer, not as text.",
          "properties": {
            "system": { "type": "string", "description": "System of record shown on tooltip hover." },
            "agent": { "type": "string", "description": "Agent or workflow that produced the data." }
          }
        },
        "updated": { "type": "string", "format": "date-time", "description": "ISO 8601. Humanized by the host renderer." }
      }
    },

    "sizing": {
      "type": "object",
      "required": ["default", "variants"],
      "properties": {
        "default": { "enum": ["small", "large", "wide", "tall", "full"] },
        "variants": {
          "type": "object",
          "description": "Must include at least one variant. Each defines grid size and which body elements are visible. Selectors and context are always visible regardless of what show contains.",
          "additionalProperties": false,
          "properties": {
            "small": { "$ref": "#/$defs/variant_def" },
            "large": { "$ref": "#/$defs/variant_def" },
            "wide": { "$ref": "#/$defs/variant_def" },
            "tall": { "$ref": "#/$defs/variant_def" },
            "full": { "$ref": "#/$defs/variant_def" }
          }
        }
      }
    },

    "workspace_ref": {
      "type": "object",
      "description": "Drill-through reference. Tap card to open the source workspace.",
      "properties": {
        "workspace_id": { "type": "string" },
        "sheet": { "type": "string" },
        "range": { "type": "string" }
      }
    },

    "resolve": {
      "type": "object",
      "description": "Optional live resolver. When present, a status indicator appears in the card header. Pre-loaded data in body serves as fallback when the resolver is unavailable or the user lacks permissions.",
      "properties": {
        "extension": { "type": "string", "description": "The hyozuboard extension that handles the fetch." },
        "method": { "type": "string" },
        "params": { "type": "object", "additionalProperties": true },
        "interval": { "type": "integer", "description": "Auto-refresh interval in seconds. Omit for on-demand only." }
      }
    }
  },

  "$defs": {
    "variant_def": {
      "type": "object",
      "required": ["grid", "show"],
      "properties": {
        "grid": {
          "type": "array", "items": { "type": "integer" }, "minItems": 2, "maxItems": 2,
          "description": "[columns, rows] on the 12-column grid. small=[3,1], large=[4,1], wide=[6,1], tall=[3,2], full=[6,2]."
        },
        "show": {
          "type": "array",
          "items": { "enum": ["value", "delta", "chart", "rows", "headers"] },
          "description": "Which body elements are visible at this size. Metric cards use: value, delta, chart. Table cards use: rows, headers. Selectors and context are always visible and do not appear here."
        },
        "max_rows": { "type": "integer", "description": "For table cards: maximum number of rows to display at this size." }
      }
    },

    "semantic_color": {
      "enum": ["primary", "secondary", "accent", "success", "danger", "warning", "info", "muted"],
      "description": "Resolved by the active theme at render time. primary = dominant data. secondary = comparison/reference. success/danger = directional outcome. muted = background-level."
    },

    "metric_body": {
      "type": "object",
      "required": ["data"],
      "properties": {
        "data": {
          "type": "array",
          "items": { "$ref": "#/$defs/metric_record" },
          "description": "Pre-loaded records. For cards with selectors, each record includes selector key-value pairs. The renderer filters by current selection. For cards without selectors, all records are always active."
        },
        "chart": {
          "type": "object",
          "properties": { "type": { "enum": ["line", "bar"] } }
        }
      }
    },

    "metric_record": {
      "type": "object",
      "required": ["value"],
      "description": "One metric value for one selector combination. Properties matching selector keys are filter values. series is an array — a single record can carry multiple overlaid series.",
      "properties": {
        "value": { "type": "string", "description": "Formatted by source workspace. The card renderer displays this as-is." },
        "delta": {
          "type": "object",
          "properties": {
            "display": { "type": "string", "description": "Formatted delta string." },
            "direction": { "enum": ["positive", "negative", "neutral"], "description": "Semantic direction. Renderer maps to theme colors: positive=success, negative=danger, neutral=muted." },
            "period": { "type": "string", "description": "What the delta is measured against." }
          }
        },
        "series": {
          "type": "array",
          "description": "Chart series for this record. Multiple entries overlay on the same chart. For multi-series, each should have a label for the legend.",
          "items": {
            "type": "object",
            "required": ["data"],
            "properties": {
              "label": { "type": "string", "description": "Legend label. Required when multiple series are present." },
              "data": { "type": "array", "items": { "type": "number" } },
              "color": { "$ref": "#/$defs/semantic_color", "default": "primary" }
            }
          }
        },
        "labels": {
          "type": "array",
          "items": { "type": "string" },
          "description": "X-axis labels for the chart. One label per data point. When omitted, the x-axis shows integer indices. Length should match the series data arrays."
        }
      },
      "additionalProperties": { "type": "string", "description": "Selector key-value pairs. Keys must match keys in the card's selectors object." }
    },

    "table_body": {
      "type": "object",
      "required": ["columns", "data"],
      "properties": {
        "columns": {
          "type": "array",
          "items": {
            "type": "object",
            "required": ["key", "type"],
            "properties": {
              "key": { "type": "string" },
              "label": { "type": "string", "description": "Column header text. Visible when headers is in the show array." },
              "type": {
                "enum": ["text", "tag", "number", "timestamp", "url"],
                "description": "Determines rendering. tag=pill badge. timestamp=ISO 8601, humanized by host. url=hidden from display, available for on_row_action."
              }
            }
          }
        },
        "data": {
          "type": "array",
          "items": { "type": "object", "additionalProperties": true },
          "description": "Row objects keyed by column keys. Timestamp values must be ISO 8601. URL values are full hrefs. Empty string means no action for that row."
        },
        "on_row_action": {
          "type": "object",
          "description": "Handler for row tap/click. Defines what happens when a user interacts with a row.",
          "properties": {
            "type": { "enum": ["open_url", "open_workspace", "navigate"] },
            "url_column": { "type": "string", "description": "For open_url: which column key contains the href." },
            "workspace_id": { "type": "string", "description": "For open_workspace: target workspace ID." }
          }
        }
      }
    }
  }
}
