[
  {
    "id": "card_revenue",
    "type": "metric",
    "header": { "label": "Revenue" },
    "meta": {
      "description": "GAAP recognized revenue per ASC 606. North America segment only. FY 2026 YTD runs through March. The +12.4% growth is driven primarily by enterprise expansion deals closed in Q4 2025.",
      "currency": "USD",
      "unit": "currency",
      "magnitude": "millions",
      "tags": ["finance", "revenue", "p&l", "north-america", "gaap"],
      "thresholds": [
        { "label": "FY 2026 plan", "value": 105.0, "direction": "above_is_good" },
        { "label": "FY 2025 actual", "value": 91.4, "direction": "above_is_good" }
      ]
    },
    "context": { "region": "North America", "scenario": "Actuals" },
    "selectors": {
      "period": { "options": ["FY 2025", "FY 2026 YTD"], "default": "FY 2026 YTD" }
    },
    "body": {
      "data": [
        {
          "period": "FY 2025",
          "value": "$91.4M",
          "delta": { "display": "+9.1%", "direction": "positive", "period": "vs FY24" },
          "series": [{ "data": [7.0, 7.2, 7.4, 7.3, 7.6, 7.8, 7.5, 7.9, 8.0, 7.7, 8.0, 8.0], "color": "primary" }],
          "labels": ["Jul", "Aug", "Sep", "Oct", "Nov", "Dec", "Jan", "Feb", "Mar", "Apr", "May", "Jun"]
        },
        {
          "period": "FY 2026 YTD",
          "value": "$48.2M",
          "delta": { "display": "+12.4%", "direction": "positive", "period": "YTD vs PY" },
          "series": [{ "data": [6.8, 7.1, 7.4, 7.2, 8.0, 8.6, 9.1], "color": "primary" }],
          "labels": ["Oct", "Nov", "Dec", "Jan", "Feb", "Mar", "Apr"]
        }
      ],
      "chart": { "type": "bar" }
    },
    "footer": {
      "author": { "user_id": "u_josh", "display_name": "Josh Meltzer", "email": "josh@acme.com" },
      "data_source": { "system": "NetSuite GL", "agent": "FP&A Analyst" },
      "updated": "2026-04-05T14:28:00Z"
    },
    "sizing": {
      "default": "small",
      "variants": {
        "small": { "grid": [3, 1], "show": ["value", "delta", "chart"] },
        "large": { "grid": [4, 1], "show": ["value", "delta", "chart"] },
        "wide": { "grid": [6, 1], "show": ["value", "delta", "chart"] }
      }
    },
    "workspace_ref": { "workspace_id": "ws_income_statement", "sheet": "P&L", "range": "H12" }
  },

  {
    "id": "card_arr",
    "type": "metric",
    "header": { "label": "ARR" },
    "meta": {
      "description": "Annual recurring revenue. All segments. Trailing calculation based on monthly recurring revenue × 12.",
      "currency": "USD",
      "unit": "currency",
      "magnitude": "millions",
      "tags": ["finance", "arr", "saas", "recurring"]
    },
    "context": { "segment": "All" },
    "body": {
      "data": [
        {
          "value": "$62.1M",
          "delta": { "display": "+18.3%", "direction": "positive", "period": "YoY" },
          "series": [{ "data": [42, 44, 47, 50, 52, 55, 58, 62.1], "color": "success" }],
          "labels": ["Q1'24", "Q2'24", "Q3'24", "Q4'24", "Q1'25", "Q2'25", "Q3'25", "Q4'25"]
        }
      ],
      "chart": { "type": "line" }
    },
    "footer": {
      "author": { "user_id": "u_maria", "display_name": "Maria Santos" },
      "data_source": { "system": "Salesforce", "agent": "Rev Ops" },
      "updated": "2026-04-05T14:02:00Z"
    },
    "sizing": {
      "default": "small",
      "variants": {
        "small": { "grid": [3, 1], "show": ["value", "delta", "chart"] }
      }
    },
    "workspace_ref": { "workspace_id": "ws_rev_ops", "sheet": "ARR Rollforward" }
  },

  {
    "id": "card_leverage",
    "type": "metric",
    "header": { "label": "Leverage" },
    "meta": {
      "description": "Total Debt divided by trailing-twelve-month EBITDA. Primary measure of balance sheet leverage. Revolving credit facility covenant requires Debt/EBITDA below 3.0x. Net Debt variant subtracts unrestricted cash from total debt.",
      "unit": "ratio",
      "tags": ["finance", "leverage", "debt", "covenant", "balance-sheet"],
      "thresholds": [
        { "label": "Covenant limit", "value": 3.0, "direction": "below_is_good" },
        { "label": "Board target", "value": 1.0, "direction": "below_is_good" },
        { "label": "Industry median (SaaS)", "value": 1.8, "direction": "neutral" }
      ]
    },
    "context": { "entity": "Consolidated", "currency": "USD" },
    "selectors": {
      "view": { "options": ["Debt / EBITDA", "Net Debt / EBITDA"], "default": "Debt / EBITDA" }
    },
    "body": {
      "data": [
        {
          "view": "Debt / EBITDA",
          "value": "0.6x",
          "delta": { "display": "-0.1x", "direction": "positive", "period": "vs PQ" },
          "series": [{ "data": [1.1, 1.0, 0.9, 0.85, 0.8, 0.75, 0.7, 0.6], "color": "primary" }],
          "labels": ["Q1'24", "Q2'24", "Q3'24", "Q4'24", "Q1'25", "Q2'25", "Q3'25", "Q4'25"]
        },
        {
          "view": "Net Debt / EBITDA",
          "value": "0.4x",
          "delta": { "display": "-0.05x", "direction": "positive", "period": "vs PQ" },
          "series": [{ "data": [0.8, 0.75, 0.7, 0.65, 0.6, 0.55, 0.5, 0.4], "color": "primary" }],
          "labels": ["Q1'24", "Q2'24", "Q3'24", "Q4'24", "Q1'25", "Q2'25", "Q3'25", "Q4'25"]
        }
      ],
      "chart": { "type": "line" }
    },
    "footer": {
      "author": { "user_id": "u_josh", "display_name": "Josh Meltzer" },
      "data_source": { "system": "NetSuite GL", "agent": "FP&A Analyst" },
      "updated": "2026-04-05T14:28:00Z"
    },
    "sizing": {
      "default": "small",
      "variants": {
        "small": { "grid": [3, 1], "show": ["value", "delta", "chart"] },
        "wide": { "grid": [6, 1], "show": ["value", "delta", "chart"] }
      }
    },
    "workspace_ref": { "workspace_id": "ws_debt_covenants", "sheet": "Summary", "range": "B47" }
  },

  {
    "id": "card_burn",
    "type": "metric",
    "header": { "label": "Net Burn" },
    "meta": {
      "description": "Monthly net cash burn: total cash outflows minus total cash inflows from operations. Excludes financing activities and one-time items. A decrease in burn rate is positive. At current trajectory ($1.8M/mo) with $32.4M cash on hand, implied runway is ~18 months.",
      "currency": "USD",
      "unit": "currency",
      "magnitude": "millions",
      "tags": ["finance", "treasury", "cash", "burn", "runway"],
      "thresholds": [
        { "label": "Board-approved budget", "value": 2.0, "direction": "below_is_good" },
        { "label": "Breakeven", "value": 0, "direction": "below_is_good" }
      ]
    },
    "context": { "entity": "Consolidated", "period": "Mar 2026" },
    "body": {
      "data": [
        {
          "value": "$1.8M",
          "delta": { "display": "-$200K", "direction": "positive", "period": "vs prior mo" },
          "series": [{ "data": [2.4, 2.3, 2.2, 2.1, 2.0, 2.0, 1.9, 1.8], "color": "success" }],
          "labels": ["Aug", "Sep", "Oct", "Nov", "Dec", "Jan", "Feb", "Mar"]
        }
      ],
      "chart": { "type": "line" }
    },
    "footer": {
      "author": { "user_id": "u_lisa", "display_name": "Lisa Chen" },
      "data_source": { "system": "NetSuite GL", "agent": "Treasury" },
      "updated": "2026-04-05T13:00:00Z"
    },
    "sizing": {
      "default": "small",
      "variants": {
        "small": { "grid": [3, 1], "show": ["value", "delta", "chart"] }
      }
    },
    "workspace_ref": { "workspace_id": "ws_treasury_model" }
  },

  {
    "id": "card_markets",
    "type": "metric",
    "header": { "label": "Markets" },
    "meta": {
      "description": "Company stock price (ACME, ticker ACM) compared against S&P 500 index. Both series show 30 trading days. Stock data is delayed 15 minutes per exchange rules. S&P line is a benchmark for relative performance.",
      "currency": "USD",
      "unit": "currency",
      "magnitude": "units",
      "tags": ["markets", "stock", "equity", "benchmark", "s&p-500"],
      "thresholds": [
        { "label": "52-week high", "value": 148.50, "direction": "neutral" },
        { "label": "52-week low", "value": 98.20, "direction": "neutral" }
      ]
    },
    "body": {
      "data": [
        {
          "value": "$142.38",
          "delta": { "display": "+1.24%", "direction": "positive", "period": "today" },
          "series": [
            {
              "label": "ACME (ACM)",
              "data": [136, 134, 137, 138, 136, 139, 140, 138, 137, 139, 141, 140, 138, 139, 141, 140, 142, 141, 139, 140, 141, 143, 142, 140, 141, 139, 141, 142, 143, 142.38],
              "color": "primary"
            },
            {
              "label": "S&P 500",
              "data": [5720, 5740, 5730, 5750, 5760, 5770, 5780, 5770, 5760, 5780, 5790, 5800, 5790, 5795, 5810, 5800, 5815, 5810, 5800, 5810, 5820, 5830, 5825, 5815, 5820, 5830, 5825, 5835, 5840, 5842],
              "color": "secondary"
            }
          ]
        }
      ],
      "chart": { "type": "line" }
    },
    "footer": {
      "author": { "user_id": "u_system", "display_name": "System" },
      "data_source": { "system": "AlphaVantage" },
      "updated": "2026-04-05T14:17:00Z"
    },
    "sizing": {
      "default": "full",
      "variants": {
        "small": { "grid": [3, 1], "show": ["value", "delta"] },
        "full": { "grid": [6, 2], "show": ["value", "delta", "chart"] }
      }
    },
    "resolve": {
      "extension": "alphavantage",
      "method": "quote",
      "params": { "symbols": ["ACM", "SPX"] },
      "interval": 900
    }
  },

  {
    "id": "card_news",
    "type": "table",
    "header": { "label": "News & Signals" },
    "meta": {
      "description": "Curated feed of macro, industry, and internal signals relevant to the business. Items with URLs link to the original source on row tap.",
      "tags": ["news", "signals", "macro", "industry", "competitive-intel"]
    },
    "selectors": {
      "tag": { "options": ["All", "Macro", "Industry", "Internal"], "default": "All" }
    },
    "body": {
      "columns": [